id_transacao,data,valor,descricao,tipo,status,conta_origem,conta_destino
aedc68f6-e063-441b-b328-17661540689e,2023-09-30,4514.84,Interesting upon sister audience sure know can.,crédito,concluído,GB75FNCG52577067943220,GB14NBTF95349370957130
c7b5584a-586b-4342-a662-cf76124da393,2024-11-08,3618.32,Third field second imagine.,transferência,concluído,GB24OFAZ30119468910258,GB67SFRW41703269914895
47d77baf-5cd9-4899-9c2d-e0dfc6a93fdb,2024-09-26,520.21,Especially join everybody best wish.,débito,pendente,GB35ADWW94618868055365,GB87NQPG71262311706675
03e49cc9-260e-4d35-83a4-2c5965a20016,2024-05-17,1465.71,Ball ok nothing dinner mention.,pix,pendente,GB81TBNX22006282954841,GB36NECU35668665060446
78623c83-b698-421f-9385-80e3fcf02cc6,2023-07-08,2942.38,Smile go be easy page per less.,pix,pendente,GB09LVDY41862951272526,GB58FDBO41353314491591
c5c8bd05-45f8-4550-8165-4fee35f3842d,2025-03-23,4063.43,Catch bank send attack recent baby identify.,transferência,pendente,GB57PNHR91259716932872,GB97RPWX04803932311239
db03890d-bb46-4380-832d-079d52ba2456,2024-10-11,2632.36,Growth on source skin standard your her.,transferência,pendente,GB03ALWM47407586829400,GB12IBPR74651264911114
a6a2a299-d461-4f08-8161-ef02aeca2f18,2025-01-25,4205.63,Imagine seven half site.,débito,cancelado,GB37RBZW16762447953456,GB78DVTD90566430837840
2e8fb46e-baa6-4637-887e-0fe9c8183d3e,2024-07-02,2600.56,Instead look street rate dark.,crédito,pendente,GB40XAOF25652366632059,GB05NBMC65186925874573
f4bac9c9-6ee4-4c69-acfa-6c306feb44df,2023-11-02,45.93,Sure real according.,transferência,concluído,GB58KADO10788071395450,GB11YNSM87727192549367
b780a109-c9a0-4c78-830b-354ceb074d27,2024-11-27,971.42,Near coach stock follow.,pix,concluído,GB46TVYX93454757199722,GB52CTLQ53491075577162
09bed7a9-6c01-4629-b23a-4a13ec08516e,2024-08-17,3791.03,Everyone painting they success green ground sister value.,débito,concluído,GB20PUIH32458518511314,GB52SLPT69426601507150
db6418c4-125c-40d9-966a-7665d7bcd67e,2023-08-13,4642.34,Only type make act camera tree should particularly.,pix,cancelado,GB41DSZR35615467342462,GB56STUL49522659214269
f59bd3a5-12a6-451a-87ea-de119adda949,2024-10-10,3494.81,Administration over summer she.,transferência,pendente,GB42IPUN00856450556491,GB37BKJN27289204672902
263d2e69-12cc-404f-86db-8d40c7760bf3,2023-12-07,746.36,Defense customer may force recent.,transferência,cancelado,GB84NYEM17202201593908,GB77OAKV90198105129405
90ce00c4-b386-408f-9c7e-ce4deb70a607,2024-12-30,4073.22,Message free if accept can.,pix,pendente,GB02LLYV32513526224507,GB76OHGH64896024377750
6f25bb09-763b-4140-9266-dec5cda9b918,2024-07-24,4533.91,Accept cost race hold start wrong sport.,débito,pendente,GB62RSRM33032489383073,GB96IEGI19943062549746
b045fc09-9e32-4a17-84e7-0c86a55a5264,2025-03-01,4220.18,No description,débito,cancelado,GB19ZAPT89954082850242,GB66FNKH80097043547994
ff8da8a9-730d-429d-8691-50a205d2a37f,2025-05-28,3471.63,Voice police response goal sport finish student.,transferência,concluído,GB59OMZE09913373092406,GB29VYNM55194878596353
be2ec72b-c056-4f8f-a7e1-d34a94ebaad2,2024-04-01,1889.18,Authority say sound environmental throw whether back method.,pix,cancelado,GB63JQPB92810738480804,GB47QRWC77678223556863
9651eada-37c0-4922-8897-d754b67dc31e,2024-12-20,4069.31,No description,débito,pendente,GB92SXHM50643719522902,GB09VAOC72723384548617
6c9dc3e9-2b6f-45d3-85a6-554abf79b79d,2024-03-18,4737.23,Reason family lay place coach check.,crédito,cancelado,GB64SXQQ96682067079162,GB81JEXM71292741483142
2dbd5fe1-51c6-40e6-a5cf-dba5c536c2ab,2024-07-01,2909.17,Letter teacher girl attorney share girl event.,crédito,pendente,GB94LCBH73352919861549,GB75XPIO71778047322394
becfaf07-6216-409d-9fa8-3c349a4ea6ea,2024-01-27,2441.52,Continue whether form few activity gun.,pix,pendente,GB28SENE32236706685416,GB34OTDF32149116473248
fb36d329-aab2-4d94-afff-9b7b5ef359ff,2025-01-28,4470.36,Election I memory could cell pick.,débito,cancelado,GB86NJKR49568356038088,GB69LVWQ48482635993880
01c227a6-1004-47eb-8a98-e3927ae38646,2025-04-30,4003.51,Baby quickly kitchen item road.,transferência,concluído,GB48BXNI45514360515630,GB59TAKN15773185784329
8bd4a336-1080-4ba0-acc8-bb97cc80d554,2024-01-31,2284.22,Common production still likely product collection policy improve.,débito,pendente,GB26UEWL94852984231362,GB36SFHD08347068062291
81ecb340-7284-4e77-b02b-4cc619e3f545,2023-12-06,4202.93,Represent same evening education action prevent.,crédito,concluído,GB61PQPC10783356511880,GB41GPBL44266359888462
99c9cbcc-9b4a-419a-ba16-9a2d9ceb50c6,2024-07-05,2283.02,Watch subject between parent water friend.,pix,pendente,GB39QZYT08071452694619,GB66HNZK10264207629587
7330fc93-c21a-4137-a4fb-2a162a834689,2024-04-30,3288.14,Hospital ask example beyond.,débito,cancelado,GB08EQTS88894360550737,GB11AHGR71887011761220
913d57ee-010e-4766-bdbb-b4f3657c6d01,2023-09-01,3524.78,National receive industry agreement.,crédito,cancelado,GB29FPQR84184370736092,GB42AKTS05535196890186
63e9dc1d-e73a-4ea7-a289-1a6087676d39,2025-04-17,3449.54,Create suggest education involve stay natural.,crédito,cancelado,GB35OYWO06721456905813,GB54FUBM42289837014310
a4100aaa-2f74-4196-a577-77b7cc0aca27,2023-11-05,4982.78,No description,crédito,concluído,GB95JGVT65861840618177,GB44OKJC69783125954310
57416f49-0c2e-4b0b-b2db-6af0758186b6,2024-02-12,4495.7,Really drug much ago.,pix,pendente,GB43VGKS24240722291757,GB10RXCO19318757017764
4a5cf055-ab50-4bc9-974c-75d536e84f32,2023-08-18,3915.47,Wind red tax hair.,crédito,pendente,GB84BGAZ12641767458026,GB64ZCLV58046883584323
7586eb6f-48ca-4a0e-97a4-4fdd9d8f21c6,2024-02-22,4672.56,Call TV final nothing according front develop.,transferência,cancelado,GB51LWZK56749681523941,GB23CISA34363785794323
59f17713-d41a-4b68-8f26-e15da9c094f6,2024-02-27,3078.39,Gun sort money hundred direction different.,crédito,concluído,GB93KWYH77247698839447,GB03DJIJ39745346383939
3cb0c100-e373-4c51-8e28-490d888b2719,2023-09-12,4948.6,Although become true well.,crédito,cancelado,GB92WPZD72662115605824,GB40JMAI32947490538872
342b00c8-a877-493d-9e41-74844dfe1479,2024-07-18,2195.21,Fact community ball wish.,crédito,pendente,GB66EUXL32134996777044,GB53UVOI37973743866052
a1580766-5dd0-4756-ac87-0692b3d33eff,2024-04-04,4415.39,Learn goal alone name worry.,débito,pendente,GB55BKFW82230591549412,GB70GGDW24901983850208
9e2c2d47-8c32-4552-980c-6a949b2c4fe6,2024-02-21,1014.99,His management ready head.,crédito,concluído,GB97HYNQ71638603197043,GB72BXVM14986642465121
6f40acf3-617c-4ba7-b038-b67f9ad97e93,2024-06-26,2460.26,Beautiful hold finish sense article.,crédito,concluído,GB79MYQT87099063227987,GB73UNBN85922364602099
18fc822a-1505-442e-9e08-0213183fb89e,2025-02-23,401.68,Create citizen down offer.,crédito,pendente,GB82DKGN82258102778144,GB79IFGB82273538084043
c14b47db-9eb9-45fe-b412-37bd7f693c73,2023-08-12,12.85,Artist car manage else investment describe head.,transferência,pendente,GB50TVMQ52428794879663,GB33HEXZ11583113512634
88a99cf8-4a06-485d-931b-96ab56689de7,2024-03-02,3097.69,Media life open machine effort.,débito,concluído,GB15LLXV76115979032831,GB34AQYU39190163082785
ca2b8ae4-161e-4082-9686-0288e0299040,2024-01-14,1661.56,Necessary hope side although.,transferência,pendente,GB11QZAB00506888246640,GB19PIMO11187163873749
e94d9bd0-9296-499f-b649-bf838194e59e,2023-09-12,6.13,Together itself practice check war happen.,transferência,cancelado,GB86INBP38131514961121,GB57DUYS88156717189519
af7ed3bd-f36c-42a5-9b39-1dff221c6315,2024-09-02,157.73,Hit decade stand town board.,débito,concluído,GB91INLG11102513717162,GB83HJQE90542791448033
0838d734-db1e-49a7-beda-214452cab9dd,2024-07-20,1789.25,Administration near catch night base enter.,débito,concluído,GB38NEIO77348766178347,GB20WWGL50201389630401
1045e4b4-eaff-439e-abc5-2822ae0ed1a9,2023-10-29,4269.43,Successful enough bit again again.,débito,cancelado,GB72CXIU35207654634199,GB18YWFQ32577328726357
8a014ff1-2cc7-459c-987b-b8737200ab27,2024-03-04,1582.68,Both world bed goal example these.,débito,cancelado,GB48XEED49034165006460,GB09UFUB59612098237838
1b0a921a-0439-4c5b-8a53-b4f685b1f25e,2024-03-13,489.32,Skin beautiful through these alone serve herself.,crédito,cancelado,GB72DSPQ87502291542280,GB07RQGS52272436481007
9a3b204f-54e1-4981-832d-8c9db39e6cf3,2025-02-23,4285.27,Administration service forget mean make hear.,débito,concluído,GB87NNWM39082878025324,GB32XIMF74639990547284
998f8789-fa34-4c3d-b11b-5ff7e7660401,2024-10-21,3341.54,Phone food teach receive feeling them yes direction.,transferência,cancelado,GB64WUYX23174832621252,GB80PQHG98581843375041
bb3ebf6f-9e04-4c86-a7b9-6ed93ed4f8e6,2024-08-15,3795.99,Describe professor avoid I week goal majority.,crédito,cancelado,GB90WXHM10828195849888,GB47SMZF21278860536521
4cec4cbc-46d7-41e8-85fe-31bdbdf48b84,2024-09-17,2202.12,Those notice join technology enter hour.,transferência,pendente,GB82SDVF62933644013179,GB30PZJZ15677991876463
dac78970-2b3f-46ff-8634-0c1ba680211b,2024-02-19,3563.18,Unit half pull light.,transferência,pendente,GB80ZTWG17365668384189,GB23FITB29229719623649
2fb830a7-59ae-4077-9e57-720d38f4dcbf,2024-05-10,3368.58,Choice piece finish similar program everything hour prove.,transferência,cancelado,GB74ICCB79203771590622,GB92DIBF84469452856921
75ca837a-1de7-4e54-9e8e-64e537702f3f,2024-01-30,2081.87,Four among still local go market.,débito,pendente,GB40CGDW38584444713196,GB31PGLI29809629959644
a46404fc-4ead-405b-afde-7b5c25237bee,2024-05-31,4681.55,Manager realize under recently their discover.,crédito,concluído,GB20DPNE39732388232788,GB70ELPB79153854126827
9e7aea58-a9ee-4919-aaac-f664b845c1c5,2023-10-28,3104.07,Time stand difference sister.,débito,concluído,GB69AIMA58349746713735,GB78RUTC06544131833394
a53a0c7f-23d6-4e61-a002-155916b170c4,2024-06-15,4051.84,Idea sure determine everybody service table.,débito,cancelado,GB82SMSB69945833973520,GB42HLPZ71557122663440
48526398-c086-45dc-a33c-e689ba024a93,2023-10-06,4068.68,Space result south north family.,débito,cancelado,GB97ASPO58461206272105,GB68VNXL80290506008535
497dbf3c-c898-4d43-97da-4dddeaf63310,2025-05-25,829.22,Whatever drop up throughout goal.,débito,cancelado,GB82TLZM08458403424938,GB78MCPG24062331662543
5bb0f286-b041-43fa-a839-2e2bafefcd63,2024-11-18,2246.99,Leader institution to human could expert.,débito,concluído,GB87ZAQF69368556562653,GB08NHFU67057257701205
2ee7ea11-a331-4669-98e9-d46561830b21,2023-07-11,3647.23,Draw act throw.,transferência,pendente,GB50TCNI85409665446531,GB53EDHO54186155275954
11529229-013f-429a-99a4-62573fe751f2,2024-11-18,2919.59,Provide market push.,pix,cancelado,GB47AOGO31933144264096,GB90LYQN07986575577750
da49320a-453a-4ca9-9074-9e0c00e065f0,2024-05-01,1305.63,Player little nature what.,transferência,concluído,GB44ITNG10188664942229,GB85ODHD70506989341816
4ffd3618-8f24-415f-a9b4-c4811fa03eb5,2024-01-01,1141.64,Read for agency six.,crédito,pendente,GB19QIHQ50154823144804,GB81TAMN59661180148553
5e7dd63f-4d91-4f1e-832f-c7489ce9d895,2024-11-11,4035.56,Finish piece discover total election early.,débito,pendente,GB07BGQQ07316367999268,GB02EKQP89862418105772
67682542-ca2b-47e8-a2dd-5dccdd4bf7e6,2023-07-18,1112.66,No description,débito,pendente,GB30PKOW05916528161715,GB56WAIB09561981750861
d41e4c4f-eea1-4375-80c0-a78a890b9b46,2024-08-25,1543.97,Box message yeah call.,débito,concluído,GB33KPZO22922865241477,GB40AEVQ79700504541469
f82380fc-0e60-4a79-9d7c-95b2b6cc8940,2024-07-09,1973.85,Level indeed Congress score network.,crédito,cancelado,GB83OQHJ24413373992486,GB22JXWE96925764769036
86bf7bda-326b-4f02-b3e5-a6b4abfe5b0a,2023-06-05,69.59,Activity way choice.,transferência,concluído,GB13LSWG82893725626829,GB58ZZYC32888719399053
b94b5ce5-7cbe-4c67-aabb-ddb0de9677a7,2023-06-27,193.09,Together add impact world piece Democrat.,pix,pendente,GB85RYHI26570937732674,GB76RFRH69315347546405
74a7afbb-63eb-4e30-aa34-15e45ea89a54,2024-07-08,2339.3,Management history traditional hot national.,débito,concluído,GB03APXM48195433691182,GB24RSSD51819279671420
b1701214-5aad-4710-bb11-9a26f0967994,2023-07-09,2633.35,Team old office chance parent morning.,pix,pendente,GB35QUDV07609667329972,GB29SAYC93867563436003
5cbbd972-a930-457c-871a-40fcd337c380,2023-08-17,672.4,Special these public big.,pix,concluído,GB02WIPY80699399347212,GB91WXYS79107973697915
bd53374f-57c7-4cc9-b312-4e19ce59f631,2025-01-02,1586.75,Question become nice shoulder.,débito,cancelado,GB57SSKF60402035451287,GB91LRDD17547905499168
09959e97-e26b-4a63-9cd5-700cd68b7a0d,2024-10-10,4874.3,Mouth anyone leader receive place major.,transferência,concluído,GB90ENQX88640487785225,GB74HUTB62683877280356
40d72750-b75f-41bc-be8b-7ddb2cb01af2,2025-05-25,2602.85,Pass western about opportunity realize pick response.,pix,cancelado,GB80UKNX91471279912205,GB48ABLI99760435594033
774ba077-f72d-4aaf-9204-098d503c6890,2024-03-26,3709.13,Mother than down note.,transferência,pendente,GB53CGAP96721248155928,GB78CZQA94770589694262
e94f2214-77b5-4e66-867c-b8bb08b0855a,2025-05-26,4326.89,Light continue decision to.,débito,cancelado,GB10QSUF03020949503832,GB43RSVJ78011154954114
bb29562f-0f3d-4bae-ba46-6ae5bfc27535,2023-09-16,582.45,At fight consider inside.,transferência,concluído,GB36BEAW95643400517589,GB78KOZO47564160604684
140cad18-0f9d-4cba-a8b5-dcd6cb92087a,2024-10-11,3722.78,Agent sign save treat development wide.,débito,cancelado,GB92SWHQ64221049578961,GB70CGOM65161603492905
c1c98764-c3a0-4afd-90ef-275d187c3c23,2025-04-11,3378.74,Mr education real your.,crédito,pendente,GB27TOMB69278943856308,GB12XWGU71179944416052
67b4e8fb-c0c9-4e87-a394-6fd9ebd7f7cf,2024-03-30,2067.91,Prepare five very each democratic.,débito,pendente,GB64HYBG27536225498607,GB51KFXJ08773923040216
1e884942-7c0f-43bd-afe6-de5b962ebd1e,2023-06-03,466.04,Join school truth center point.,crédito,pendente,GB85IHXL29963254886159,GB02OVCI74809033256571
9b90bfba-b30a-40fc-8f92-521ed9b747cb,2023-06-24,3340.07,Meet share job.,pix,cancelado,GB56QAHJ02529184048819,GB42FZGA05073688487695
d52ada3f-6e66-47f8-8a17-849c52f161a5,2024-09-13,2814.02,Interesting conference stage conference those measure.,pix,pendente,GB79AXCO28252798353391,GB71URDB29136969681828
2d7f65b1-182b-455b-ac81-df637363867f,2024-12-28,3852.58,Fine home eye join employee.,transferência,concluído,GB27EBPP48654624059790,GB83ZISQ29105577464496
3f51efe2-ca55-468c-97f4-c1d2129bd12c,2023-08-15,2285.26,Affect option rule agent chance lay.,transferência,pendente,GB24BZVF74721076583888,GB14ZAJP11944011459276
311ebc3e-8128-43db-8c8b-f7d800e8963c,2024-03-04,3339.15,Number talk age never.,transferência,cancelado,GB10PZVU32743059895601,GB50AFJY98361384506060
1b9ef304-3e1e-4693-b954-34711877cd0c,2024-06-11,3323.44,Sister build next note far.,pix,pendente,GB44DIIN03077584511356,GB44PALE55360999781093
7a259ddd-3de9-4735-abf1-10013826ac39,2023-09-18,2425.09,Behind beyond standard contain last what big degree.,pix,pendente,GB85ERQM02017746020562,GB13UKCL12438603886803
38c24ac5-f29c-4d84-b11f-7da6ab025d29,2024-04-16,590.64,Talk parent these example station.,transferência,cancelado,GB78TOWA71762585249831,GB54VFSJ66320344281592
c91e37fc-9302-43eb-af59-17181b93cedd,2025-02-09,4715.13,No description,crédito,pendente,GB89NMRF18171144861804,GB90TUQW17672118617505
80f17f13-00ac-418b-851f-802656e4ab6e,2024-10-14,1749.7,Base bit worry or.,transferência,cancelado,GB51ZDPL14493397908757,GB46LDYU52188686556033
195cc5bc-0c9b-47d3-a546-5eab1d2fa375,2024-11-25,3234.62,Design way father off us.,débito,concluído,GB66CXTP33011835615397,GB74CVCO85203940013651
54345e5c-3cad-485d-b9cf-2707dc6e885a,2025-02-11,2318.22,Pass manager day election thus.,débito,concluído,GB07KSUP00624501558651,GB34JAWI33145042755314
18254a01-5db9-46c9-bac4-7b24f391c821,2025-01-14,995.58,Assume build base far.,crédito,cancelado,GB16JIXQ87980680814473,GB32PXRF91123305410013
2b07627f-50fa-473d-b0ab-eeee8865a6a2,2023-11-28,1848.39,Question to indeed camera my about foreign.,transferência,pendente,GB23IYGL14348497412550,GB20PVCM31580452110637
f00d45ae-938e-4426-b37a-7fff382e11ba,2024-12-19,4604.3,Resource seat voice bad actually.,crédito,pendente,GB55IZQW01615369780324,GB52AKWW10157122065352
2718c5fe-db24-40be-839b-9e56ed5c0fda,2024-11-04,206.26,Indicate none challenge hard ask large hospital.,transferência,cancelado,GB30LYSI70726346115350,GB96CIGE34825040089654
f24882b5-64b8-4b70-8582-1421ddf7f953,2023-10-12,3978.01,Treat sing spend suffer general for.,transferência,pendente,GB44PNCO67920131580448,GB14AMNN68533518715055
e93a9e3f-49ce-4a06-bd52-63c7b361eb5e,2025-03-24,4151.78,Race ability statement say summer stock.,pix,pendente,GB18ACHK39032865388832,GB71KYOT10625475839660
0d2b353c-c48a-40d0-a669-8c8f2da6d028,2023-08-20,1128.92,Up gun similar follow table open ten.,pix,concluído,GB12NLSW64083180032589,GB22BKGU30425247772394
ba501d76-6191-424f-92d8-5dc30130aa89,2024-08-31,2235.98,Strong recent series fund growth program experience.,pix,pendente,GB13RGJE02496527111022,GB93LDPZ56779996581718
f0a86311-50d1-44fb-8829-52dcdc6c7fba,2024-04-28,3016.31,Event statement you can entire.,crédito,cancelado,GB44LOXT14660591712984,GB23THCJ79738370583960
c69ddd4f-d7ce-488e-b378-ece1be5a063c,2025-02-11,2342.76,Mission person section price too leg surface.,transferência,cancelado,GB70ZXZS63599203585601,GB16UNBX56522314441582
5b8474dc-2fd2-45f7-b5c8-d43582157251,2023-11-09,4597.25,Common three apply effort.,pix,cancelado,GB30CWFF54048373330587,GB20RHGT86792823521144
b6ca961d-2fb9-4f8e-a652-37fb2376b628,2024-07-21,4685.73,Body remember perhaps among office up.,débito,pendente,GB66KFNH86665400355653,GB31KAEX82436604318079
b77ceda0-c82d-4270-b062-418dedc97a8d,2024-05-23,1829.54,No description,pix,cancelado,GB04UWFK53284230345733,GB75FHNK26538852803526
da54e161-5e34-4ec8-b7e8-96495029db0c,2024-02-27,3463.88,Around item a build matter.,débito,pendente,GB94WSZR59496987776679,GB79YBCK36158738658537
2b75d24c-584e-4e0f-8690-f9e45ecec7fe,2023-08-09,4415.5,Assume hair real clear scientist.,transferência,concluído,GB65WQGJ79298212480688,GB40YRAV22966519938652
4d2efb86-e4ef-430a-91ae-f01a245cfd92,2024-06-23,1183.27,No description,débito,cancelado,GB56BJKJ23264297841088,GB29OGLW22821114276980
c37fe5a4-ac54-4f6d-b2a7-4eed5dfc214b,2024-04-03,3523.4,Do adult western reflect style.,pix,cancelado,GB81LTUY81039948718561,GB25HBBO46187016698687
0666411d-7904-4d95-b361-8249882d21cb,2024-09-30,1857.1,Probably up fine join final.,crédito,concluído,GB51RCDU81787037026766,GB89OTUR09665729474968
f9a8eb2d-bcbb-47eb-a9bf-5c6ad36674c8,2024-05-30,2629.18,Face beautiful everybody number food great property.,débito,cancelado,GB46ZBUE30249397041933,GB65ZGCW77762681325509
6071b8b9-7a3e-4d46-b629-f3025ab94fce,2025-03-14,462.87,Recent very pull stage.,transferência,pendente,GB08ZARB30723826696777,GB95GFIB29742533129883
11e4a266-4262-4ed8-b479-7e01f1852b9b,2023-12-04,3602.71,Set return dream line.,crédito,concluído,GB56JTCT00057826409304,GB53OMIW23222875605963
c979e199-68de-4663-b573-67cbfd1d1b8a,2023-09-29,1512.32,Style point power.,transferência,concluído,GB35EKTB26833391348152,GB83RWGV62815100161469
6cf60fee-2257-4ee7-8a89-ee1ab02dc06d,2024-02-19,74.42,Himself pass two free cultural step.,pix,concluído,GB79AHAU80388957702489,GB48VFFL15395977058505
c724c416-34db-4a07-bae2-8b7f10638ca2,2025-03-23,4470.77,Fight quality military song budget hear those.,pix,cancelado,GB44XVHB54860151458394,GB17WNPT40809358891075
38d3b654-3e5a-406f-a06a-34b1640bd12e,2023-10-24,3098.79,Service money difficult.,pix,concluído,GB61NTGY99220734766091,GB59AXQD51557230029228
3c5e626c-0dff-4db7-9222-f92202c8ee8d,2025-04-18,3303.8,Ability woman produce environmental free.,pix,cancelado,GB22XNUV77205035601392,GB88NXGX75107076514182
7328ff7d-5bbe-4bcc-917e-a846d56f9e6f,2024-08-03,3610.87,Six determine condition these low glass.,crédito,pendente,GB80CISU85838299985121,GB92RKPJ97397211879145
d7a5d98e-2504-4605-90a7-278ba4dfdde7,2024-12-27,3929.41,From gas get over sort despite protect.,crédito,concluído,GB96DCIU08263974568751,GB24PSSB52800696662561
55d44903-7f04-4654-971b-66e7b097a717,2023-09-24,2421.92,Specific within system because become lot.,débito,cancelado,GB17XFBZ68158511689162,GB58GLFW09845556689826
74977987-46e8-4544-a6dc-534143684cc2,2023-09-28,4655.29,Significant across total.,débito,pendente,GB79HUJW63575744623576,GB74RBUL09304264669966
eb7106ba-10b2-4a6a-9668-a137357fce70,2023-09-03,1246.47,Laugh sister speak.,débito,pendente,GB30QNWD10886570314297,GB03ABSF65845631893442
2e5aeb57-3762-46ba-a391-5ee8a27fea13,2024-08-15,4909.02,Financial water have everyone.,crédito,concluído,GB29CSFU24624594012399,GB86RJJE83007704401448
2e649e17-a85d-47c3-9bf7-78a9f8b7d8e4,2023-09-26,4570.01,Seek future step grow worker baby.,crédito,cancelado,GB84NSOQ62776716853595,GB86WEQE79996830313244
2a34c146-0f4f-40b3-860a-7c588bbc7cb7,2024-02-02,3703.06,Successful floor stage pressure hospital.,débito,pendente,GB86JTRE38670735286106,GB97QEBA22432723761103
0739bf1b-f82e-4428-83a8-55fb24aa3e58,2023-11-04,4210.25,True last which.,pix,concluído,GB64RQUM61976756374334,GB83YWBN50284547296802
046404de-e1c7-4fc4-9b44-d2d035dfe28f,2024-01-26,4906.54,Charge knowledge like news.,transferência,cancelado,GB54ROAY02607993786458,GB78RSFQ10218390694514
94cdd264-1dcd-4d8b-8176-35fa68f9a2b7,2024-01-10,4572.64,Lot down look some color card.,transferência,pendente,GB94EAJD79161497946375,GB95YMCC43418036080705
750826ec-ad5f-4425-a270-24ae35655f64,2025-05-07,4579.25,Music daughter enjoy news ability.,crédito,concluído,GB33NWGY71011593698810,GB88REUW39809942072489
3016446b-1922-4a60-bd18-3621563ef32e,2025-03-09,1424.47,Black statement wide husband.,transferência,cancelado,GB26RDXY22153024257239,GB92POFC91293595092253
5b7460e5-b79f-4518-b439-f9eac6934fce,2023-08-04,1434.24,Enough law respond friend century.,pix,concluído,GB89UYDO89696185976722,GB39GQVZ23356421709307
b236652d-4542-4687-8719-1ab5b4bbf479,2024-03-18,1308.07,House agency want sport.,débito,cancelado,GB69HKNE53279781015378,GB94ALKS46452693310786
c3bc4f9a-55b5-4ac5-be4e-5d390757b039,2024-03-22,1180.81,Onto hear camera debate country either.,débito,concluído,GB26SJLB48574919810031,GB59ALOP49890320484448
c8e4f698-6e73-44c6-a6d9-88b9aafb11a6,2024-08-23,226.97,Perform thus difficult.,crédito,pendente,GB30UKBB97070078561975,GB88MIVX41197880251032
20798f37-f04c-4c56-a14a-67fdaf6cc237,2024-07-14,4131.9,Clear action building practice across case.,transferência,concluído,GB22QNQK50986801701863,GB21KIKA06926957506493
d5200fbe-d6ab-4c6a-82e8-092917136d1d,2024-08-09,2346.66,Open decade security occur base sign him.,transferência,concluído,GB97APVQ80768540793762,GB95GNSL72101743245688
77105bbf-1b9a-4d8b-a56c-7c0a626e6f9e,2025-03-07,3630.14,Fall citizen whatever audience.,transferência,cancelado,GB43CNEY04599566339998,GB09NUOI67612298584004
747fcd5b-9ba0-41ce-bd69-2426091109c7,2024-05-14,3546.86,I go item child present.,transferência,cancelado,GB05NPBE96689228553291,GB61LGZA99309664212288
e7dadffa-c8ce-469b-a1f3-527e28a83ce1,2024-04-17,1150.99,No description,débito,concluído,GB26WKZA90172490597731,GB12LPYG12641148864060
1cff2cc6-7e23-41cb-8f95-6c9801d1e8db,2023-08-17,1802.74,Any floor water avoid none long them.,pix,concluído,GB68WXSH67544147134543,GB17JRQZ03214765530578
5194f56e-04cb-4a51-a840-d009fe75c186,2024-10-05,759.23,Lay people first letter age treatment benefit stay.,crédito,pendente,GB96OQGN48439240442067,GB13FRQY58737171819538
25cf7b0f-8c19-44b1-9383-bdeebcc92fe3,2024-11-21,4479.04,Trip hear while able enough raise need.,crédito,pendente,GB51YUFO78675715889707,GB56XFJS02121912602429
64013b6f-1ca2-4f69-a77b-cd882cbca0d4,2024-12-06,135.27,Action behind important any mission.,transferência,cancelado,GB81BMTK25593290234344,GB97MSSF47296448897475
c8e944d0-1fb4-49e0-ae07-fedd0803d227,2023-07-21,430.68,Family national behavior feel.,crédito,concluído,GB13VHIS00421896169481,GB73RPAD41759598404530
52b644f0-481d-46f8-b62f-3162cc60043a,2023-09-28,509.66,Between job career pattern hour two item.,débito,concluído,GB41IZAS42745348116471,GB26LIZI51527263893833
63cd8ea5-c8de-4948-9178-b54e00e93891,2023-09-13,2747.46,Morning become water wonder.,crédito,concluído,GB82PMMS35541675793674,GB24ZHKU92341104119686
3f471a24-537e-4c2f-b316-583cc76ea6f7,2023-10-07,3735.06,From customer analysis produce everything grow.,débito,cancelado,GB32FIXH64358154361507,GB95PYPN02220673997614
260357eb-fa1b-4ef0-a87a-a9add0fc1b34,2023-06-17,1737.5,Word American pick close various pass amount.,transferência,cancelado,GB37OEKW74964112236591,GB89WGZV04984206132351
4ffdada0-3611-41d9-a4b3-d86fce29672e,2023-11-25,3120.82,Professor blue clear ready fear bad.,crédito,concluído,GB39RXZR23193664326216,GB70DOSO13345398212054
b465b099-81be-47e2-80c2-1aa762fe63d5,2023-08-06,725.92,Debate couple can watch year.,transferência,concluído,GB29VFNR85078513108588,GB35OCEJ71270295277914
e6f61f63-fa18-48af-91ca-45f292348b9c,2024-09-04,158.84,Car second mother approach.,pix,pendente,GB63ENKE53594613366992,GB21BYBE21818370352959
4f0a911d-254e-4cef-bb93-c4b748d60932,2025-05-18,189.66,Body performance fight call police really particularly when.,transferência,pendente,GB18OPZQ81259917847842,GB46MDNP33932800116360
42598ba2-0855-4137-b663-0bcb69ac3060,2024-03-06,1320.92,Protect bring including view.,débito,concluído,GB12TGGE74274998405436,GB64LAPP88238289004619
90277ddc-8608-4dbb-9161-41305d73b827,2024-11-22,2834.83,Husband build wait expert trouble.,débito,cancelado,GB14JJDR63432006318197,GB08JRAY64137333342227
6063f167-7aa4-4314-ad81-0d9da53ae0ad,2024-12-23,117.71,House become toward whether.,crédito,cancelado,GB53KZGK59845655346122,GB63BPUO72048355335949
06297135-c42c-4aaa-a101-2a955bff2ae9,2024-12-05,2810.21,No description,pix,cancelado,GB06FYTP70153240480347,GB61BKPN94883359714692
60f0f905-64a1-4a03-bb18-249d0e6aba07,2025-03-13,1574.59,Politics chair person actually serve.,pix,concluído,GB38USRT57331451216211,GB49HVOC62917649513526
