id_transacao,data,valor,descricao,tipo,status,conta_origem,conta_destino
12ec2403-9471-4895-96d8-bffff3b461e8,2024-10-23,581.64,Particularly above author think who.,pix,cancelado,GB38MZIH50424522548354,GB67FXRC65431901020773
e48aeef7-ddcd-47f9-ac57-647fb60f7901,2024-07-26,4388.38,Fire trouble sport arm strong.,pix,pendente,GB69GSLM56099056776311,GB43SQJT48550030540830
f74389f6-9063-4703-b899-b3802c772dee,2024-10-05,4423.78,Outside toward start anything concern once.,débito,cancelado,GB84USKA70022978201296,GB96JVAL03585924291885
3be36b02-6eec-4773-842d-7f0fdd084310,2023-10-23,1126.51,Address job along down arm else father beat.,transferência,concluído,GB19ZVJO55480518435529,GB86QEKO53166529276190
84c276b6-403d-4fdb-83dc-49d42ee71faa,2025-06-02,322.49,Tough senior who land perform.,transferência,cancelado,GB62OHAT39657113723338,GB12SXRV90574195170303
3cc1eea7-dede-4a19-81ac-f8ec07760419,2024-10-14,3196.38,Technology structure couple point responsibility.,transferência,cancelado,GB08PXWX99511681615230,GB66QFLR86456187848010
7df8e024-7d51-4ccf-9eb6-6336a276d405,2024-05-31,2209.97,Inside rate read call tend.,crédito,pendente,GB92DFPV44448722338930,GB95HYRU26031739708207
243a43cf-45a8-4253-a52a-616e59f9ee3e,2024-05-09,2949.09,General case during.,crédito,cancelado,GB08RHYK77817402554192,GB30ZSRX46817094229619
1b95bf16-7780-4bee-ac5d-3cab6b781cb8,2024-06-24,2704.2,Study Mr identify sport account computer step.,pix,pendente,GB05TDWD52844952164267,GB60IDJC12811410927655
cae9a817-f96b-40d7-ba08-b8ab706c7c4b,2023-11-10,2680.17,Wall decision idea according.,crédito,cancelado,GB04LCVQ25538330354481,GB42MUER66892768898735
9266a418-1156-4461-bcf6-2358a7ea29d7,2025-05-05,2117.08,Citizen cover form success concern attention often.,débito,concluído,GB87PMYM18537316728662,GB90RMKB62569916806358
5a088190-9b70-4eea-8be9-917aea6a36cd,2023-11-10,2844.64,Seem however program discuss like certainly kitchen.,pix,pendente,GB79CKGZ22933180444306,GB77UJYK55324493790573
55018282-3534-4e02-8c5a-46356987a704,2023-07-28,4290.07,Behind garden these floor security.,crédito,pendente,GB14HCMJ98347880411319,GB74AGLI98181967976501
4e8cb222-5b2b-443c-89cc-b2780ebb6ad3,2023-10-06,3486.7,Long Mr worker.,débito,concluído,GB79ITLH68540668944057,GB78YJWK91646666325798
b031c339-3153-42e2-8e3b-8c5d9edc7913,2024-08-22,1770.63,Voice whatever huge sing month necessary action.,transferência,concluído,GB87ODJA64221675490942,GB34YUZS88201159741582
19a5ee6a-4a54-4f56-bf8d-db81e34b6cbd,2023-08-06,4959.7,Eat pull interesting watch learn.,crédito,pendente,GB06MKZL46964961655077,GB74CQFL43921849928421
6dc80b0a-c413-4560-b705-06d389be0d41,2025-02-10,374.38,Process significant partner still paper successful each character.,crédito,pendente,GB08UWBJ14205490947112,GB53GPWV52124990839370
6976d7fa-3677-4d66-88b5-946750a99811,2024-01-21,4385.98,No description,crédito,pendente,GB84YFBC59220242288665,GB47GKNI22399673839551
5db00305-7f4f-4616-97c5-fdfa492f8cc0,2024-08-08,2335.04,Buy work subject system attack.,crédito,cancelado,GB82RSSV08249698513866,GB65GPFC43466707836029
9ba74fa9-99e9-4e3c-844b-a2220e0d59f6,2023-12-16,2390.85,Lawyer challenge program population certain.,pix,pendente,GB90JUSM89919463374810,GB96CDMU26561907762188
fc31ecdb-93f3-4258-a045-7f4076ce6154,2023-07-09,3526.85,Card task wind speech effort.,crédito,concluído,GB34HBAH23291698354081,GB36TWSM55291337277265
00ba82ab-6fb1-4df6-9f60-69dd9fcb3191,2023-09-05,3113.93,Subject whole chair out who.,transferência,cancelado,GB69PZBL41470413100227,GB78ZLAK64942292827748
7164c85f-bebf-4499-8c46-f1d2a013b07c,2024-11-28,493.34,Wind customer there out send usually.,transferência,pendente,GB56JBTT03383726595415,GB27RREV85950136780432
d3550222-e09a-4ab9-8cb6-cfe7414e8e0a,2024-10-23,58.62,About form along heart father those they.,crédito,cancelado,GB07UWTZ07125220103769,GB49PKCZ06557509916192
3ee9f7c2-3d2c-4107-b55b-b8fc154db0a0,2025-04-07,4037.84,Discuss growth truth.,crédito,concluído,GB54COSF58971271098503,GB22FSBB68713679405389
0f044ee4-7aa4-4e3f-a377-62235b7afcfd,2024-03-20,62.3,Wrong ask particularly cup.,débito,concluído,GB82VBQW56621405045622,GB50AFFT68398034751490
9ef638bc-fb23-4311-8dca-e7c694aa1a75,2024-08-08,3722.68,Goal prove good economic mind peace commercial maintain.,pix,concluído,GB24NDYC74187734328477,GB37BMJH52080095201497
93be476a-7ef7-4295-841b-87c4eb6ee650,2025-04-27,283.52,Away cause support space entire clear level imagine.,crédito,cancelado,GB09JRZY36398818505554,GB12WKQM15573052834102
a943fc55-e000-45ad-a516-18117bedff93,2024-03-08,497.39,Instead north price leg read material always.,débito,concluído,GB21ZSKM18681346380271,GB03RFCR39517617750219
19794480-83ce-4ecc-a8a0-1a3db34ca9f0,2023-10-08,1051.48,Pressure edge write officer financial worker.,pix,cancelado,GB55ZMFA29384016766839,GB14GSTT87214591079372
0f4da9e9-3aa0-412c-85f1-e86d2456f738,2024-10-01,132.25,Defense wait fight people entire.,crédito,pendente,GB93SMDM19233989493996,GB26PPPO83517568007912
62377dcb-639d-4e9f-9cd1-b89f8ae76573,2023-10-31,4615.7,Sing pretty ten theory his.,débito,pendente,GB37ADYB61664984837808,GB26MFIE69741499653280
2898a495-9ef8-46d3-b33e-6087589f9b54,2024-03-01,3211.56,Road course table shoulder.,débito,concluído,GB09CZKD58908618316458,GB88JADS37790156012273
2909ce22-7d13-43ce-ad47-b8a7f834a6b9,2024-08-09,2223.9,Clear cup bank investment part different.,crédito,concluído,GB29NXWI07792146209445,GB57XGAE29617205416414
323ac8ea-9a64-4001-8f42-82da6245c01f,2024-08-07,393.41,Film industry family might site until.,transferência,concluído,GB75XMIE53452248401916,GB33RLKP29232104045490
8e4347f0-14ed-41f1-8486-b66898ecc4b6,2023-10-05,3947.49,With its customer opportunity team lead indeed about.,pix,concluído,GB28EEIF01215063174178,GB70DTVN10593998962800
b9588614-98ff-4b31-8e5e-b62d01d3af44,2023-11-30,2356.09,Arrive raise personal without reduce result.,débito,cancelado,GB02VFBH95324542207789,GB93WUJG33077163184515
f161e48e-67db-4f4c-b891-ff6ad41bb8e5,2025-05-26,4071.89,Add responsibility deal send model collection.,crédito,pendente,GB18WCIJ21931611060896,GB58RWCI35773117716329
22724e9c-d07e-4e8b-9d21-de81db2872a0,2024-08-11,126.68,Life author difference see write church too.,transferência,cancelado,GB04OMWN47132529956186,GB33ANFC06629068985903
aee1671f-2ec8-415b-bddf-af4526207a3e,2023-09-27,3906.57,Party history evening head already.,transferência,cancelado,GB54ZDHQ35595771744259,GB96UHMD73724473426230
58619d3b-5519-4f1d-a06f-ad08dc1e6c64,2023-08-03,513.36,Represent happen why toward data.,crédito,concluído,GB96CDDS37787719174299,GB58VQQL13632711623629
02249168-6b30-46b5-a176-2324a38b6e56,2024-12-19,4180.14,Hope could matter possible fly method.,crédito,pendente,GB84APVA91416993828272,GB49DNCM39791228943310
8c0461b4-8d0f-4e39-b701-82f8447318c0,2024-07-26,2837.05,Have environmental player.,transferência,cancelado,GB63TCYU18587161343947,GB24IYDY91679978326611
68d8cfac-15d0-4af0-beec-2108a5cf7a5c,2025-01-04,2363.26,Power morning buy avoid reflect.,pix,pendente,GB96KYKZ91821037254469,GB97OSAH19367788159093
4e5da906-bf09-4e4e-bbc6-566ffaf57199,2025-03-14,260.97,Trip establish low over boy only board Congress.,crédito,cancelado,GB49SCEZ64566222827596,GB55WKOJ04992782258945
00629a2c-a443-45f4-a4f8-4baaa2da832b,2023-06-16,2839.47,As carry since all strategy.,transferência,concluído,GB69MSCU80810339027908,GB15QFWU97580748010173
80142a60-3371-457d-8d1c-dfd0c5a5b810,2025-02-19,4794.15,Science spend several model.,débito,cancelado,GB59OPTN38969412180456,GB82FIJP41483895581608
fd3d7853-a011-4531-b007-9cc2dc925599,2025-03-14,2411.83,No description,crédito,pendente,GB73TPVY14375905926357,GB16RDMN30232225571532
53ba6925-75e1-4a0c-8934-eb68fa624139,2024-11-16,4022.65,Light agency everything daughter night become forget.,pix,pendente,GB86NPFU76755852023880,GB24HFOS59837429024491
f8c30512-dba6-4509-be51-93ca959ef9fa,2024-06-21,537.1,Important purpose above baby outside.,débito,concluído,GB38BSSV71117021526131,GB55BQQQ54878944054788
fa420af0-236e-4c2a-ac78-1a0830130b59,2023-08-22,3582.42,Crime especially almost recognize politics central.,transferência,concluído,GB85SQLS07302064366237,GB51NBKL23285270671755
68382b85-5f45-4e5a-b66a-4101117dcff7,2023-10-19,2955.69,Care color allow answer its right until join.,crédito,pendente,GB73GIYK34897234572446,GB72IXCR11885617137169
d340c75b-3b44-481d-9405-650e5bf87859,2024-08-07,2210.71,Become particularly determine worry.,transferência,cancelado,GB27IHRS34993063579721,GB30LATZ71513184816983
fe401ed5-5ce6-4ec1-a7f7-dda240a40542,2024-05-18,4802.58,Pick including little some and.,crédito,cancelado,GB39AXJR88280226196424,GB81OQKH67683152136195
a27ce808-85f0-4c3d-b862-ae1b226ef4bd,2024-02-21,45.93,Not painting theory compare.,débito,pendente,GB59XNGD00609832672605,GB77SOUY50343071736952
7916e779-a5e7-4998-aea9-4b81dbb4b37b,2024-09-14,4569.14,Center figure today dream.,débito,concluído,GB35LTBN32248783462832,GB79ECKC75490707137603
f4bfd17c-dde0-4139-8438-1f491ba9458a,2024-03-18,1581.29,Cold effort hit.,crédito,cancelado,GB97OQPC05802928772788,GB31PIZJ19267170388854
0a034007-d18d-4a2d-a2df-bf10e647820d,2025-01-28,1273.44,Source person consumer.,crédito,pendente,GB21TZRB89061583514847,GB16AVTC46603098119209
7349f835-c183-4048-8dc9-8994cbf90137,2023-11-20,3980.69,Career method usually dog behavior range similar.,pix,cancelado,GB89IJEC82630492169973,GB42YHNP07988134009291
d1f93046-0c34-41e0-9ff2-3bf9adfeb622,2024-09-20,279.61,Key kid idea good hospital work no.,crédito,pendente,GB29ZQKA78041197750014,GB86FFGX29809924113428
3725663f-e667-4868-b5f4-b186bdf624b5,2024-09-04,2999.52,Mouth morning message break nor father travel.,crédito,cancelado,GB69MJIW02135996560560,GB37AQOV60395976029368
67137d36-2119-468d-9d1a-e58a9ee67369,2023-06-24,4325.66,No description,débito,cancelado,GB89HRWW61228592009523,GB56ANUN31680118369027
389a6565-cdb9-4762-a0e0-d5da45245abf,2024-04-10,747.38,Budget it experience its positive.,pix,pendente,GB61PXLQ40545347250266,GB48OSWM37107397933734
3443e105-c5b6-4c94-aefc-54a9e570131c,2023-08-10,3192.04,Give event customer ground agent leg.,débito,concluído,GB82BZZO39643295334616,GB62YZML39081230212438
b58c1ae2-4d20-4008-b031-86b7ebd51867,2025-02-08,1876.57,Back everybody child skin theory ahead expert.,transferência,pendente,GB69LWLH56486099369171,GB49WUGS72003996154881
96527b2b-fb03-4ec5-8ecc-fab5c4b35af0,2025-05-30,272.69,Forward effect which deal.,crédito,cancelado,GB94NJIA85566137891124,GB24XECR78056525095721
0cac96ab-52f9-4d3e-81d3-8b9b309324b9,2023-11-10,667.25,Daughter trouble light record them.,crédito,pendente,GB13MCGJ27753245542395,GB52RKNJ49780968397393
b6ab62a8-28d5-4ade-aef8-fb9089976e9c,2024-07-16,247.12,His more tell wonder on just school.,pix,cancelado,GB29ROWZ57056142868005,GB77KZVW65625217130330
4254a33c-fba4-48bf-a0a2-3d853a6caf5a,2025-04-07,4624.61,Watch site happy want pass.,transferência,pendente,GB44RGIS56487498279863,GB94KIYM80078349851064
7fd07ca9-11fb-4e3e-ae43-16cdff2cdf6a,2025-02-21,4902.43,Edge matter within major.,pix,cancelado,GB27UTZF94917619444396,GB73DIHR12160212792936
5d0d7b66-fef9-4016-8718-6ee070db95e3,2024-12-19,60.95,Prepare statement TV enough west compare.,pix,cancelado,GB89WZKA32868016802693,GB51SFYU77623341930224
28150360-68a9-4fb5-911c-acc3288e1d07,2024-07-30,4699.14,Act ok long seem evening after.,pix,concluído,GB59MDRV74256402945744,GB35RUIB18923297962047
8ed1faf7-4d83-4170-ba7b-616d4f94eee2,2024-06-07,3637.18,Player huge kitchen green face name religious.,transferência,cancelado,GB85FKME51220409185267,GB17EVZM40813737450864
ecfebfa1-3558-47f3-846b-6614ef52b18b,2024-10-23,3458.48,South pay travel dog.,pix,pendente,GB64FPGB21400498574274,GB83PFTJ86191241680075
de88627a-2302-4fc2-b639-33148d02ca74,2024-10-05,4024.49,Science voice power.,transferência,cancelado,GB41CZHW90572889088745,GB16AKMY17083524070436
9ac09e9e-3c16-47f1-98e5-9dc080640bb1,2023-12-04,1549.26,Way spring former vote firm.,crédito,pendente,GB47FSAR87665013507692,GB19XXSJ19318627403194
0aa4c179-92a3-4eda-bf28-deb5c3fcef5c,2023-08-16,4801.31,Memory yet its analysis condition.,débito,concluído,GB13TPYQ03585430451335,GB58MDWG74016725772153
723c0d8b-5799-4ecd-b364-1fc019c0d1d0,2025-04-10,802.3,Term unit attorney couple election hospital.,débito,cancelado,GB76HMTB72674033443985,GB13JBMP40621610265560
e8706b44-5847-4703-a0b5-a5a9e1294015,2024-01-03,4959.91,Decade much successful hospital program magazine.,transferência,concluído,GB67TGMV37372344643516,GB48IVRP96102274355992
46471214-5da1-44f7-83a6-0b4e5de7a3d3,2025-04-25,4042.32,Under particular threat day possible.,pix,pendente,GB52ROCJ91023655612847,GB04DZZK03451166590494
508a9975-7409-4cdc-a202-c6ef63f994d8,2024-02-13,4097.92,Mr score positive almost market too chance.,débito,concluído,GB68NNDZ01504094471278,GB34OXFS06540504909001
ef2b70b2-6a1f-4a9b-8f3c-ece024432c57,2024-06-23,1048.82,Scientist as stay page action trouble ago or.,transferência,pendente,GB62WMFV79285654337694,GB78ZKBM45731645783388
0865a150-97e6-4045-b1f3-2693f0ae2591,2024-10-09,4593.8,Staff tonight say fight reach fast sea.,débito,cancelado,GB98YGZU69135022795120,GB23ATOJ77510619693207
25d76c31-fc12-477a-a104-cd9bf3ac02fb,2025-01-24,2108.15,Data rock task study.,pix,concluído,GB13ISQC94395990516238,GB85VZJW94327092518835
6e53e3f8-6a12-4add-93fe-169d4ca414db,2025-05-23,3861.67,Why believe past.,pix,cancelado,GB96AWVU83040787246338,GB58VWBQ29639611102980
c40c4c48-f6f5-4512-a410-4fe75af117cc,2024-11-03,3084.8,Own son major fast.,transferência,concluído,GB92IXES47740386306534,GB28LAJZ52895490212914
8e067f18-6f63-4834-9329-aeb0817cc781,2023-08-09,3556.93,Than weight choose once how bad visit.,transferência,pendente,GB56ZGYJ36884679700864,GB82HDEQ94400994573843
8e66d577-db78-413c-a700-24d60fcf1947,2024-04-13,2560.43,Hospital tend read remember cost live local bed.,transferência,concluído,GB74JRYS76325407452226,GB75PXUP75365455767391
f60f13e1-3add-4c75-9e94-1c5d2f857144,2024-11-07,165.41,Contain anyone certainly car contain alone song put.,pix,concluído,GB24DJMB14700571762234,GB54XIII51896577422112
ad741527-e51f-4222-9217-ef5a5983e168,2024-08-25,1012.69,Brother remember beyond special argue very job.,transferência,cancelado,GB19MNKV38114560129496,GB02TMGV97595371224164
4b492f5d-d703-46bb-9400-5aae765895f1,2024-09-15,2144.48,Control include author right chair minute.,débito,cancelado,GB75UGBC64541182425956,GB19HBPQ92731348363384
446a70a9-077f-43fd-8d12-e96a4ba42f41,2024-07-20,2991.01,Visit body measure rise professor newspaper.,crédito,pendente,GB49YCEE23849398959992,GB49EUQG02076092681381
00165eb4-213f-49a6-b967-56a8fba5c884,2024-04-09,4392.28,Just peace adult ago international economic why.,pix,concluído,GB02LYMO27349991382442,GB55KIKH73501008717997
4ecd042c-c2ef-4d6b-a86c-bfc7b0a7104e,2024-12-08,3408.71,Ahead some according ago beyond yet.,débito,concluído,GB92GEJU35145135371937,GB51NEJX00488719971781
63fce14c-d2ed-4ea2-a125-f87c98abd99e,2025-02-04,1286.79,Recognize writer outside money.,transferência,pendente,GB89OREI39512517367216,GB35ROWR76397870472759
300c8754-4931-4de8-82cd-b7b07caa624a,2024-04-25,2037.26,Cell together standard benefit authority manager admit whom.,transferência,pendente,GB56SVMT65583679436856,GB93QCJW06297338856956
b8dc5b95-a2f2-4431-a6f0-991f95680a30,2025-03-18,157.56,Scientist field realize what wonder become church interview.,crédito,pendente,GB76XEJS81005583598231,GB41NKBQ33584532900649
7532281e-d8d8-4ae4-9ac0-6b983fbe1e53,2024-01-21,2637.2,One late need market explain.,transferência,concluído,GB65UCYE08567177741582,GB12OPBC37365849186065
0b80f15b-4553-44d8-afc4-93bb74efb76c,2025-01-11,2182.15,Opportunity well small say per talk.,transferência,pendente,GB27IHIB47838307262701,GB26ACDA40711271130362
4fd4b6b3-06f3-4711-a3e1-84ef3fee0c7f,2024-05-10,3117.17,Top wide want standard yourself north.,transferência,cancelado,GB08WZLY01171494266139,GB27VLTC09287481941629
bb7213a8-b8f2-48b2-abc9-87c6287d44e6,2024-08-13,1095.68,Suddenly sport mission process minute pattern thousand military.,crédito,concluído,GB61WNXB83409371464952,GB95SOXB48162402415460
ae9ef566-c82a-4b02-b26a-1b62cded207b,2023-08-02,3774.13,Necessary car individual kid forward.,transferência,concluído,GB56XAMQ34942695559642,GB66NHUE48874500534382
58cb7ee3-752c-4f23-b889-73056cba43d8,2024-12-10,2064.81,Less simple though camera.,débito,pendente,GB39JQBB76465309827772,GB25PBXC91243678650418
234338eb-7fca-415f-a99f-1bfb7812b6ce,2025-05-12,92.66,Generation scene education watch agent skill war serious.,transferência,concluído,GB83UINL78182318414011,GB20WBES49538691619542
d64efdc4-120a-47b8-98b1-a2628844cb22,2023-12-05,1307.94,Size information our itself call organization impact.,crédito,pendente,GB96XPHU74884660782866,GB68FLLT64998361119563
748f7bae-5a5c-4ea9-a2af-987b78cde7ab,2025-01-20,4147.71,Yard religious case concern.,pix,cancelado,GB85TTMK68780751338205,GB50GKEY64567743730953
20a6adb3-2e30-44d3-b79f-225e42d05f49,2025-01-23,620.78,Benefit hospital here serve administration chair.,pix,pendente,GB50DSXY28049600252811,GB59OPPB92372055368918
97c1ab6d-77cd-4fca-a4ac-a3b0f98366ea,2024-02-29,778.74,Similar sign room.,transferência,cancelado,GB02CMXK60732536818392,GB15HQQG67278825841662
89902299-1267-4cfb-b064-f04f30446855,2024-12-10,2726.26,Forward senior career hold above a live low.,pix,cancelado,GB59KBQY76196878467519,GB77QWLI92014987772780
138d0b8a-b442-4fb7-8c00-9a856efc92f3,2024-03-20,2621.41,Store less very drop half but business serve.,pix,pendente,GB43ZQGN98275995003929,GB85YBWT85789672272683
7fc2409b-0ed5-4123-8cf8-a550870303ef,2024-06-25,1528.45,Amount best have lead can.,transferência,cancelado,GB48TYVY32312873450775,GB71GXPR99952617803514
3ba11e1b-af91-4034-88c2-80df22ca837b,2023-11-15,1929.41,Different accept trouble focus expect free camera Democrat.,pix,pendente,GB80OFUT07493584185724,GB68EXCH20243048344263
971d1c80-c0a1-4404-a746-9987ec6e17cd,2024-03-28,3725.56,Various material firm all conference lawyer.,transferência,cancelado,GB22BXDW51254752470961,GB85HYJS65778636205921
8aa6a349-cc17-46d9-83d9-35fa913356fd,2025-05-29,4359.76,Art the law ago sing here claim.,crédito,pendente,GB74UYUZ73383411061717,GB49DVVK68954399019184
792f35ca-2f76-47d1-97a3-712bfb71186d,2024-12-12,3237.96,Grow third night prepare.,transferência,concluído,GB74OVIR29419039259298,GB92ENHI25910310650752
04c2018d-7168-45b3-9e56-f2a83484e63d,2025-03-21,2623.39,Work fund society understand exist actually poor moment.,pix,concluído,GB61JPBL78686117194781,GB39HBIR14860502511536
707a02af-712f-492d-91dc-50724f8ae00b,2024-07-14,356.82,Number toward somebody.,débito,concluído,GB27BPUB85455883530575,GB55OBNL23687342444255
eb987beb-8e76-42ac-a999-83c3bb52a4ba,2024-09-16,1854.08,Event check general beat kitchen write.,crédito,pendente,GB33JDCZ03311311943138,GB83XDHD56715061621454
f52727c0-e586-4ac7-a75a-e01cd6462a38,2025-05-26,4766.13,Here he water seat live lot good but.,débito,pendente,GB47UBTG83679515831439,GB16PZZL90666692939847
53fd7344-5065-4f3c-b669-dbb1f39fe2fc,2023-10-31,2032.31,Myself training article.,pix,pendente,GB42LSIK28710736072503,GB57IRLN74152731110343
89f4daec-885c-4bb6-9277-c02746647c0d,2024-06-16,1366.21,Save including statement company finally.,débito,cancelado,GB58GDJN97389566069937,GB98FDST17474949031538
7273cc49-8f13-448a-b767-8fac38f23db6,2024-02-14,1332.06,International training institution half movement.,transferência,pendente,GB82JIDT31680914659640,GB76JQAY52070114401681
152cc279-a5df-41e6-94e4-51d82b3732a6,2024-03-21,2197.51,Dog four we day.,crédito,pendente,GB33CNKK81312574582823,GB11WMHG08556254632412
e161bc2a-964a-4f40-b995-28e363fa4025,2023-06-06,245.12,Former account commercial look watch throw.,pix,concluído,GB59JEFX74502076048730,GB54KDSL57470990401316
c7c3ed7d-5672-4ea2-b4dd-2edd00af63ef,2025-01-29,4982.77,Discuss throughout once owner attorney how magazine.,pix,concluído,GB12VTXY87665254591590,GB10HSQO26325732457471
5a8891a8-e2c0-403b-8acb-8c5d358e4c57,2023-12-05,4928.45,Cup prevent thought member stuff education.,crédito,pendente,GB48WJTA78193318643745,GB13YYBZ53206657433356
e23df240-8271-42a5-96ea-72c2bece89b4,2023-10-19,1597.68,No several news require.,pix,concluído,GB51ONDD02128965742612,GB69KWVD60171686375137
85ea987e-daec-4d45-9080-d27ee360a914,2023-10-23,837.99,Customer believe she somebody rate land against sign.,pix,concluído,GB70GNYU80350272342551,GB64RZBA55590233539565
ed2a3e99-08f4-4e1e-8cf1-72917988d6a0,2024-12-28,4024.98,Compare husband black design.,pix,concluído,GB33GNXR49598299912007,GB75QSUH19476675825293
009550c2-42a1-4f26-9b8c-903a6eefc987,2025-01-30,2187.52,Born condition success attention which kid.,débito,concluído,GB86WOXX77369464143945,GB82VKFX64387339099505
d70f0636-44b1-49e3-a5db-550172ba8c3e,2023-07-28,2565.23,Dinner administration understand movement.,pix,cancelado,GB59FMWI64482932470476,GB80UAGW89837435097067
405354cc-0595-4f64-869b-f61508f29de4,2024-04-21,2939.75,Change much kid onto ago mind outside particularly.,transferência,concluído,GB70ONFC75117731382558,GB30CKXH26485398894420
0eb5a694-6759-4ce8-8cd8-b97aafedfc61,2024-04-03,2759.35,Decade chance investment today.,transferência,cancelado,GB18GMIG02940091188052,GB81HKUD00289569173941
776600db-70ae-4c89-abf9-57922d0734d5,2023-09-29,3906.64,Cultural parent real generation.,débito,pendente,GB23RJBC59128606706720,GB73OPRD71953988204261
b7e58aae-3cca-4f41-bb96-15d00b25a808,2023-08-03,832.02,Under most should reflect prepare huge thousand.,transferência,pendente,GB14AEXQ89590004796494,GB48UONE22703666268724
168d1911-d563-4124-ae09-1038eba78b79,2024-02-23,3110.72,No description,transferência,concluído,GB05FSIN78607131275279,GB08KSYG14332075395874
f0c113f5-f97a-4598-893f-93a75fe2a0db,2023-08-16,3528.04,Culture next others buy line.,transferência,cancelado,GB43KXFI23988567371182,GB24ZLKE21552493751198
061ea81d-5c30-4c22-9cde-ac8ffb9bc469,2023-12-12,4838.48,Far order its think discussion project use table.,débito,cancelado,GB48NPMF82479851446868,GB84XSGJ80575499524182
fe129f6b-7b67-42c1-b01a-0d67afe18bce,2024-11-26,2974.96,Administration commercial ground agreement myself.,débito,pendente,GB93TMSE45933182738426,GB91CWCA19471586117460
86cd1c1b-4737-4a5a-8750-08e4fcad0a7b,2023-12-06,393.97,Financial no sound southern.,pix,concluído,GB98PPAG50849756925135,GB72OLRP10453688001289
2ef7acd8-3997-463f-bf76-7e4d158d9242,2023-08-27,1142.28,Remain as personal couple.,débito,cancelado,GB32PCPF73741906591783,GB64CZNR77201875635560
b9ad3833-69d8-4ebb-8c5d-e7a945f05c05,2024-12-08,531.62,Region energy outside indicate talk happy.,transferência,concluído,GB97LBRY94277499903571,GB63RJFV42643691869314
09aa6b2c-266b-4d76-8da7-0d589522ff33,2025-05-25,1350.25,Claim cover off room record.,crédito,cancelado,GB32FYVR74792017985313,GB19KJTD11864199336569
d59fee02-0f48-4b9a-ab13-46942e5c2783,2024-05-30,260.53,Film store network lose.,pix,cancelado,GB75ZUVW87605958350819,GB31PHQU35786796350466
44357dab-1476-48d7-adf1-9a0cc2900db9,2025-02-05,2059.32,Decade character affect either student economy campaign.,débito,concluído,GB71FRVL35619113360680,GB63XSFE50771960608156
708bff7d-c7ef-4bdf-9423-1d5a5842142b,2024-07-30,1188.36,Suffer movie talk myself series determine key.,transferência,concluído,GB79ZRPT10159550856099,GB73PSJX16837943091859
f13bf9ba-bf2e-4c8a-9891-73fc44f9f935,2023-09-02,2364.15,Record house north this baby anyone have form.,débito,pendente,GB13MKOH64184568255964,GB81MDNA13770916068588
13d0799b-bdab-478e-a714-63d3e50e68c5,2024-11-20,1998.2,Human either speak large may cultural per.,crédito,pendente,GB94RXXW50797010757260,GB06WKOU19525032508022
44859ba7-6b91-499e-905f-b1f2ad9ef76b,2024-03-30,3646.26,Former Mr himself imagine instead rest.,pix,cancelado,GB47MKHP47558520665772,GB70TMGZ63400473318320
5d6a57c4-077e-42a7-9f9a-bfa8b58dc0a6,2024-03-30,4183.17,Project mother artist its yet.,débito,concluído,GB56QFGH99321803306718,GB69ANPS50218353236213
d8526c0c-405d-4080-83fc-eda73777b002,2024-07-28,3042.63,Consider up conference alone chair.,transferência,concluído,GB84GZEI52672956832586,GB69JVII81199724272999
09286c6a-e8f8-4999-a07a-5f4d57cd7109,2023-07-25,4395.71,Choice use consider media foot pick cost.,crédito,cancelado,GB07BTYC43502737577984,GB35DALH01111744247026
6ef3281d-c57c-470b-a405-eb9d02879edd,2025-04-24,4464.21,Republican southern both top yourself.,débito,concluído,GB57XCKQ62019003603095,GB50PYJL74740522717859
a5e74079-53cb-4083-931a-f2244cbd6c3b,2024-02-14,3323.39,What call office key report must they.,transferência,concluído,GB39DDLM22652287482884,GB62RDQP33343577271257
3d632b7c-b24d-450f-a889-6320bf5a1c5d,2023-06-25,1039.41,Us unit trouble woman best these people.,crédito,pendente,GB52GFCD33782038894090,GB07SMVO25180657106312
7d3bc834-6a25-42ac-8cb5-549de37b238a,2024-08-10,4946.22,Happy cell process debate still anything shake.,transferência,concluído,GB98JTLJ36382679150931,GB70LPCP19847903745566
67d3b2a8-e683-42ea-b89c-ce8afa8a40cf,2023-10-09,709.39,Lot sort sea across.,transferência,cancelado,GB39IRZW71113441202339,GB42LGDL78414029475386
1d9317f0-3be6-42de-9047-c45c58c6dea8,2025-05-25,2787.18,Exist take course scientist.,transferência,pendente,GB08GZUG04549058969820,GB88ISJM03298186856300
53408aba-9ff4-4464-991b-5ccdb63a9bc1,2025-04-07,1079.85,Third take a force wish trip director.,crédito,concluído,GB07JRNB10095056679603,GB36JGEW80036908519886
22bba074-7e1e-42aa-85c1-cee736ae41e3,2024-07-08,2285.11,Newspaper traditional culture check not fast.,pix,concluído,GB64IRYT90818437053235,GB78DOGW26762218801916
05527981-4ae0-41b7-a026-8d7dbbbb4c50,2024-11-24,1882.46,Little key evening.,débito,cancelado,GB66RXAH20970829216771,GB79BMDP99670816062491
ca65c7b6-2a13-4669-bac5-c47d0e839f76,2025-01-31,2392.14,Commercial almost buy professional.,crédito,concluído,GB40BNPU78416980959074,GB27HSJE05286079842468
